{
  "schemaVersion": "0.1.0",
  "module": "oleaut32",
  "description": "Wave 4 OLE Automation metadata, with selected low-payload BSTR, variant, and safe-array lifecycle hooks.",
  "apis": [
    {
      "module": "OLEAUT32.dll",
      "name": "SysAllocString",
      "family": "ole-automation",
      "category": "bstr_allocate",
      "risk": "medium",
      "hookPolicy": "iat",
      "coverageStatus": "defined",
      "architectures": ["x86", "x64"],
      "callingConvention": "stdcall",
      "returnType": "BSTR",
      "errorSource": "none",
      "success": { "returnNotEqual": "NULL" },
      "failure": { "returnEqual": "NULL" },
      "parameters": [
        { "name": "psz", "type": "const OLECHAR*", "direction": "in", "decode": "utf16_string_optional", "nullable": true, "maxBytes": 512 }
      ]
    },
    {
      "module": "OLEAUT32.dll",
      "name": "SysFreeString",
      "family": "ole-automation",
      "category": "bstr_free",
      "risk": "medium",
      "hookPolicy": "iat",
      "coverageStatus": "smoke_verified",
      "architectures": ["x86", "x64"],
      "callingConvention": "stdcall",
      "returnType": "VOID",
      "errorSource": "none",
      "success": { "returnEqual": "void" },
      "failure": { "returnEqual": "void" },
      "parameters": [
        { "name": "bstrString", "type": "BSTR", "direction": "in", "decode": "pointer", "nullable": true }
      ]
    },
    {
      "module": "OLEAUT32.dll",
      "name": "VariantClear",
      "family": "ole-automation",
      "category": "variant_clear",
      "risk": "medium",
      "hookPolicy": "iat",
      "coverageStatus": "smoke_verified",
      "architectures": ["x86", "x64"],
      "callingConvention": "stdcall",
      "returnType": "HRESULT",
      "errorSource": "HRESULT",
      "success": { "returnEqual": "S_OK" },
      "failure": { "returnNotEqual": "S_OK" },
      "parameters": [
        { "name": "pvarg", "type": "VARIANTARG*", "direction": "inout", "decode": "pointer", "nullable": true, "captureTiming": "pre" }
      ]
    },
    {
      "module": "OLEAUT32.dll",
      "name": "SafeArrayDestroy",
      "family": "ole-automation",
      "category": "safe_array_destroy",
      "risk": "medium",
      "hookPolicy": "iat",
      "coverageStatus": "smoke_verified",
      "architectures": ["x86", "x64"],
      "callingConvention": "stdcall",
      "returnType": "HRESULT",
      "errorSource": "HRESULT",
      "success": { "returnEqual": "S_OK" },
      "failure": { "returnNotEqual": "S_OK" },
      "parameters": [
        { "name": "psa", "type": "SAFEARRAY*", "direction": "in", "decode": "pointer", "nullable": true }
      ]
    }
  ]
}
