{
  "schemaVersion": "0.1.0",
  "module": "rohitab-import",
  "description": "Draft API definitions imported from a Rohitab-style XML fixture.",
  "apis": [
    {
      "module": "KERNEL32.dll",
      "name": "FixtureUnresolved",
      "family": "imported",
      "category": "imported",
      "risk": "medium",
      "hookPolicy": "definition_only",
      "coverageStatus": "definition_only",
      "callingConvention": "stdcall",
      "returnType": "BOOL",
      "errorSource": "GetLastError",
      "parameters": [
        { "name": "Context", "type": "PVOID", "direction": "in", "decode": "unresolved" }
      ]
    },
    {
      "module": "KERNEL32.dll",
      "name": "GetTempPathW",
      "family": "file-io",
      "category": "path_query",
      "risk": "medium",
      "hookPolicy": "definition_only",
      "coverageStatus": "definition_only",
      "callingConvention": "stdcall",
      "returnType": "DWORD",
      "errorSource": "GetLastError",
      "parameters": [
        { "name": "nBufferLength", "type": "DWORD", "direction": "in", "decode": "byte_count" },
        { "name": "lpBuffer", "type": "LPWSTR", "direction": "out", "decode": "unresolved" }
      ]
    }
  ]
}
