{
  "schemaVersion": "0.1.0",
  "module": "dbghelp",
  "description": "Wave 4 metadata for low-payload DbgHelp symbol-session lifecycle APIs.",
  "apis": [
    {
      "module": "DBGHELP.dll",
      "name": "SymInitializeW",
      "family": "symbols",
      "category": "symbol_session_initialize",
      "risk": "medium",
      "hookPolicy": "iat",
      "coverageStatus": "smoke_verified",
      "architectures": ["x86", "x64"],
      "callingConvention": "stdcall",
      "returnType": "BOOL",
      "errorSource": "GetLastError",
      "success": { "returnNotEqual": "FALSE" },
      "failure": { "returnEqual": "FALSE" },
      "parameters": [
        { "name": "hProcess", "type": "HANDLE", "direction": "in", "decode": "handle" },
        { "name": "UserSearchPath", "type": "PCWSTR", "direction": "in", "decode": "pointer", "nullable": true },
        { "name": "fInvadeProcess", "type": "BOOL", "direction": "in", "decode": "byte_count" }
      ]
    },
    {
      "module": "DBGHELP.dll",
      "name": "SymCleanup",
      "family": "symbols",
      "category": "symbol_session_cleanup",
      "risk": "medium",
      "hookPolicy": "iat",
      "coverageStatus": "smoke_verified",
      "architectures": ["x86", "x64"],
      "callingConvention": "stdcall",
      "returnType": "BOOL",
      "errorSource": "GetLastError",
      "success": { "returnNotEqual": "FALSE" },
      "failure": { "returnEqual": "FALSE" },
      "parameters": [
        { "name": "hProcess", "type": "HANDLE", "direction": "in", "decode": "handle" }
      ]
    }
  ]
}
