{
  "schemaVersion": "0.1.0",
  "module": "psapi",
  "description": "Wave 3 low-payload PSAPI v1 module-query metadata hooks for process module identity and MODULEINFO fields.",
  "apis": [
    {
      "module": "PSAPI.dll",
      "name": "EnumProcessModules",
      "family": "module",
      "category": "process_module_enumeration",
      "risk": "low",
      "hookPolicy": "iat",
      "coverageStatus": "smoke_verified",
      "architectures": ["x86", "x64"],
      "callingConvention": "stdcall",
      "returnType": "BOOL",
      "errorSource": "GetLastError",
      "success": { "returnNotEqual": "FALSE" },
      "failure": { "returnEqual": "FALSE" },
      "parameters": [
        { "name": "hProcess", "type": "HANDLE", "direction": "in", "decode": "handle" },
        { "name": "lphModule", "type": "HMODULE*", "direction": "out", "decode": "module_handle_array_pointer", "nullable": true, "captureTiming": "post" },
        { "name": "cb", "type": "DWORD", "direction": "in", "decode": "byte_count" },
        { "name": "lpcbNeeded", "type": "LPDWORD", "direction": "out", "decode": "dword_pointer", "nullable": true, "captureTiming": "post" }
      ]
    },
    {
      "module": "PSAPI.dll",
      "name": "GetModuleInformation",
      "family": "module",
      "category": "process_module_information",
      "risk": "low",
      "hookPolicy": "iat",
      "coverageStatus": "smoke_verified",
      "architectures": ["x86", "x64"],
      "callingConvention": "stdcall",
      "returnType": "BOOL",
      "errorSource": "GetLastError",
      "success": { "returnNotEqual": "FALSE" },
      "failure": { "returnEqual": "FALSE" },
      "parameters": [
        { "name": "hProcess", "type": "HANDLE", "direction": "in", "decode": "handle" },
        { "name": "hModule", "type": "HMODULE", "direction": "in", "decode": "module_handle" },
        { "name": "lpmodinfo", "type": "LPMODULEINFO", "direction": "out", "decode": "module_info_pointer", "nullable": true, "captureTiming": "post" },
        { "name": "cb", "type": "DWORD", "direction": "in", "decode": "byte_count" }
      ]
    },
    {
      "module": "PSAPI.dll",
      "name": "GetModuleBaseNameW",
      "family": "module",
      "category": "process_module_base_name",
      "risk": "low",
      "hookPolicy": "iat",
      "coverageStatus": "smoke_verified",
      "architectures": ["x86", "x64"],
      "callingConvention": "stdcall",
      "returnType": "DWORD",
      "errorSource": "GetLastError",
      "success": { "returnNotEqual": "0" },
      "failure": { "returnEqual": "0" },
      "parameters": [
        { "name": "hProcess", "type": "HANDLE", "direction": "in", "decode": "handle" },
        { "name": "hModule", "type": "HMODULE", "direction": "in", "decode": "module_handle", "nullable": true },
        { "name": "lpBaseName", "type": "LPWSTR", "direction": "out", "decode": "utf16_string", "nullable": true, "captureTiming": "post" },
        { "name": "nSize", "type": "DWORD", "direction": "in", "decode": "byte_count" }
      ]
    },
    {
      "module": "PSAPI.dll",
      "name": "GetModuleFileNameExW",
      "family": "module",
      "category": "process_module_file_name",
      "risk": "low",
      "hookPolicy": "iat",
      "coverageStatus": "smoke_verified",
      "architectures": ["x86", "x64"],
      "callingConvention": "stdcall",
      "returnType": "DWORD",
      "errorSource": "GetLastError",
      "success": { "returnNotEqual": "0" },
      "failure": { "returnEqual": "0" },
      "parameters": [
        { "name": "hProcess", "type": "HANDLE", "direction": "in", "decode": "handle" },
        { "name": "hModule", "type": "HMODULE", "direction": "in", "decode": "module_handle", "nullable": true },
        { "name": "lpFilename", "type": "LPWSTR", "direction": "out", "decode": "utf16_string", "nullable": true, "captureTiming": "post" },
        { "name": "nSize", "type": "DWORD", "direction": "in", "decode": "byte_count" }
      ]
    }
  ]
}
