{
  "schemaVersion": "0.1.0",
  "module": "version",
  "description": "Wave 3 low-payload Version resource metadata hooks for bounded file version queries.",
  "apis": [
    {
      "module": "VERSION.dll",
      "name": "GetFileVersionInfoSizeW",
      "family": "resource",
      "category": "version_info_size_query",
      "risk": "low",
      "hookPolicy": "iat",
      "coverageStatus": "smoke_verified",
      "architectures": ["x86", "x64"],
      "callingConvention": "stdcall",
      "returnType": "DWORD",
      "errorSource": "GetLastError",
      "success": { "returnNotEqual": "0" },
      "failure": { "returnEqual": "0" },
      "parameters": [
        { "name": "lptstrFilename", "type": "LPCWSTR", "direction": "in", "decode": "utf16_string" },
        { "name": "lpdwHandle", "type": "LPDWORD", "direction": "out", "decode": "dword_pointer", "nullable": true, "captureTiming": "post" }
      ]
    },
    {
      "module": "VERSION.dll",
      "name": "GetFileVersionInfoW",
      "family": "resource",
      "category": "version_info_load",
      "risk": "low",
      "hookPolicy": "iat",
      "coverageStatus": "smoke_verified",
      "architectures": ["x86", "x64"],
      "callingConvention": "stdcall",
      "returnType": "BOOL",
      "errorSource": "GetLastError",
      "success": { "returnNotEqual": "FALSE" },
      "failure": { "returnEqual": "FALSE" },
      "parameters": [
        { "name": "lptstrFilename", "type": "LPCWSTR", "direction": "in", "decode": "utf16_string" },
        { "name": "dwHandle", "type": "DWORD", "direction": "in", "decode": "dword_value" },
        { "name": "dwLen", "type": "DWORD", "direction": "in", "decode": "byte_count" },
        { "name": "lpData", "type": "LPVOID", "direction": "out", "decode": "version_info_buffer_pointer", "nullable": true, "captureTiming": "post" }
      ]
    },
    {
      "module": "VERSION.dll",
      "name": "VerQueryValueW",
      "family": "resource",
      "category": "version_value_query",
      "risk": "low",
      "hookPolicy": "iat",
      "coverageStatus": "smoke_verified",
      "architectures": ["x86", "x64"],
      "callingConvention": "stdcall",
      "returnType": "BOOL",
      "errorSource": "GetLastError",
      "success": { "returnNotEqual": "FALSE" },
      "failure": { "returnEqual": "FALSE" },
      "parameters": [
        { "name": "pBlock", "type": "LPCVOID", "direction": "in", "decode": "version_info_buffer_pointer" },
        { "name": "lpSubBlock", "type": "LPCWSTR", "direction": "in", "decode": "utf16_string" },
        { "name": "lplpBuffer", "type": "LPVOID*", "direction": "out", "decode": "version_info_value_pointer", "nullable": true, "captureTiming": "post" },
        { "name": "puLen", "type": "PUINT", "direction": "out", "decode": "dword_pointer", "nullable": true, "captureTiming": "post" }
      ]
    }
  ]
}
