{
  "schemaVersion": "0.1.0",
  "module": "handle",
  "description": "Wave 3 low-payload current-process KERNEL32 handle metadata hooks.",
  "apis": [
    {
      "module": "KERNEL32.dll",
      "name": "GetStdHandle",
      "family": "handle",
      "category": "standard_handle",
      "risk": "low",
      "hookPolicy": "iat",
      "coverageStatus": "smoke_verified",
      "architectures": ["x86", "x64"],
      "callingConvention": "stdcall",
      "returnType": "HANDLE",
      "errorSource": "GetLastError",
      "success": { "returnNotEqual": "INVALID_HANDLE_VALUE" },
      "failure": { "returnEqual": "INVALID_HANDLE_VALUE" },
      "parameters": [
        { "name": "nStdHandle", "type": "DWORD", "direction": "in", "decode": "std_handle_selector" }
      ]
    },
    {
      "module": "KERNEL32.dll",
      "name": "GetFileType",
      "family": "handle",
      "category": "handle_metadata",
      "risk": "low",
      "hookPolicy": "iat",
      "coverageStatus": "smoke_verified",
      "architectures": ["x86", "x64"],
      "callingConvention": "stdcall",
      "returnType": "DWORD",
      "errorSource": "GetLastError",
      "success": { "returnNotEqual": "FILE_TYPE_UNKNOWN" },
      "failure": { "returnEqual": "FILE_TYPE_UNKNOWN" },
      "parameters": [
        { "name": "hFile", "type": "HANDLE", "direction": "in", "decode": "handle" }
      ]
    },
    {
      "module": "KERNEL32.dll",
      "name": "GetHandleInformation",
      "family": "handle",
      "category": "handle_metadata",
      "risk": "low",
      "hookPolicy": "iat",
      "coverageStatus": "smoke_verified",
      "architectures": ["x86", "x64"],
      "callingConvention": "stdcall",
      "returnType": "BOOL",
      "errorSource": "GetLastError",
      "success": { "returnNotEqual": 0 },
      "failure": { "returnEqual": 0 },
      "parameters": [
        { "name": "hObject", "type": "HANDLE", "direction": "in", "decode": "handle" },
        { "name": "lpdwFlags", "type": "LPDWORD", "direction": "out", "decode": "handle_information_flags_pointer" }
      ]
    },
    {
      "module": "KERNEL32.dll",
      "name": "SetHandleInformation",
      "family": "handle",
      "category": "handle_metadata",
      "risk": "low",
      "hookPolicy": "iat",
      "coverageStatus": "smoke_verified",
      "architectures": ["x86", "x64"],
      "callingConvention": "stdcall",
      "returnType": "BOOL",
      "errorSource": "GetLastError",
      "success": { "returnNotEqual": 0 },
      "failure": { "returnEqual": 0 },
      "parameters": [
        { "name": "hObject", "type": "HANDLE", "direction": "in", "decode": "handle" },
        { "name": "dwMask", "type": "DWORD", "direction": "in", "decode": "handle_information_mask" },
        { "name": "dwFlags", "type": "DWORD", "direction": "in", "decode": "handle_information_flags" }
      ]
    }
  ]
}
